{
  "template": "sit-down-restaurant",
  "version": "1.0.0",
  "modules": {
    "social_proof": "auto",
    "owner_story": "auto",
    "faq": "auto",
    "private_dining": "auto",
    "full_menu_link": "auto"
  },
  "expression": {
    "hero_pattern": "auto",
    "hours_in_hero": "hide",
    "menu_highlights_mode": "auto",
    "menu_highlights_max": "6",
    "typography": { "headings": "playfair", "body": "source-sans" },
    "colors": {
      "accent": "#8b2942",
      "accent_bright": "#a83a55",
      "surface": "#f8f6f2",
      "surface_muted": "#ece8e0",
      "text": "#1a1410",
      "text_soft": "#4a4540",
      "dark": "#1e3a2f"
    },
    "density": {
      "hero": "medium",
      "menu_highlights": "tight",
      "atmosphere": "open",
      "visit": "tight"
    }
  }
}
