{
  "template": "sit-down-restaurant",
  "version": "1.0.0",
  "modules": {
    "social_proof": "auto",
    "owner_story": "auto",
    "faq": "auto",
    "private_dining": "auto",
    "full_menu_link": "auto"
  },
  "expression": {
    "hero_pattern": "auto",
    "hours_in_hero": "auto",
    "menu_highlights_mode": "auto",
    "menu_highlights_max": "auto",
    "typography": { "headings": "fraunces", "body": "work-sans" },
    "colors": {
      "accent": "#c45c26",
      "accent_bright": "#e8923a",
      "surface": "#faf7f2",
      "surface_muted": "#f0e8dc",
      "text": "#1a1410",
      "text_soft": "#5c5248",
      "dark": "#14100e"
    },
    "density": {
      "hero": "medium",
      "menu_highlights": "tight",
      "atmosphere": "medium",
      "visit": "tight"
    }
  }
}
