{
  "template": "sit-down-restaurant",
  "version": "1.0.0",
  "modules": {
    "social_proof": "off",
    "owner_story": "off",
    "faq": "off",
    "private_dining": "off",
    "full_menu_link": "off"
  },
  "expression": {
    "hero_pattern": "A",
    "hours_in_hero": "hide",
    "menu_highlights_mode": "menu",
    "menu_highlights_max": "8",
    "typography": { "headings": "bodoni-moda", "body": "outfit" },
    "colors": {
      "accent": "#b08d44",
      "accent_bright": "#c5a059",
      "surface": "#f8f1e1",
      "surface_muted": "#efe6d4",
      "text": "#141210",
      "text_soft": "#6b5e4a",
      "dark": "#0a0a0a"
    },
    "density": {
      "hero": "open",
      "menu_highlights": "medium",
      "atmosphere": "open",
      "visit": "open"
    }
  }
}
