{
  "template": "sit-down-restaurant",
  "version": "1.0.0",
  "modules": {
    "social_proof": "auto",
    "owner_story": "auto",
    "faq": "auto",
    "private_dining": "auto",
    "full_menu_link": "auto"
  },
  "expression": {
    "hero_pattern": "auto",
    "hours_in_hero": "show",
    "menu_highlights_mode": "auto",
    "menu_highlights_max": "6",
    "typography": { "headings": "literata", "body": "nunito-sans" },
    "colors": {
      "accent": "#c4783a",
      "accent_bright": "#d9924f",
      "surface": "#fdf8f3",
      "surface_muted": "#f5ebe0",
      "text": "#2a1f18",
      "text_soft": "#5c4a3d",
      "dark": "#3d2a1f"
    },
    "density": {
      "hero": "medium",
      "menu_highlights": "medium",
      "atmosphere": "open",
      "visit": "tight"
    }
  }
}
