{
  "template": "sit-down-restaurant",
  "version": "1.0.0",
  "modules": {
    "social_proof": "auto",
    "owner_story": "auto",
    "faq": "auto",
    "private_dining": "auto",
    "full_menu_link": "auto"
  },
  "expression": {
    "hero_pattern": "A",
    "hours_in_hero": "hide",
    "menu_highlights_mode": "auto",
    "menu_highlights_max": "4",
    "typography": { "headings": "bodoni-moda", "body": "jost" },
    "colors": {
      "accent": "#8b7355",
      "accent_bright": "#a68b6a",
      "surface": "#f5f2ed",
      "surface_muted": "#ebe6de",
      "text": "#1a1410",
      "text_soft": "#5c5348",
      "dark": "#0f0d0b"
    },
    "density": {
      "hero": "open",
      "menu_highlights": "open",
      "atmosphere": "open",
      "social_proof": "open",
      "visit": "medium"
    }
  }
}
